W,Whats the deal with your marriage?,"We're not married yet, but we're getting married in a few months!",W,When does your son go to sleep in the evening?,"He goes to sleep around 6:30. And I'm not sure how old he is, but I think he was born in the summer.",M,How about a little bit on Messi getting the ESPY award for Best Male International Athlete?,He's not a male.,W,Whats wrong with one person contributing more?,"Nothing. But if you think it's the same thing, why not have the same amount of people contribute?",M,What should Knicks fans appreciate about Pat Riley?,His mustache is beautiful.,W,"How would speaking to him, or asking an adult who I trust to speak to him, put his future in jeopardy?",You don't think that would have been a problem?,M,How many schools from minor conferences schedule their games against opponents like Alabama hoping to generate revenue for their programs?,"Not many, but there are several that do.",M,How is a typical engineer like me supposed to know who to vote for?,Just vote for someone who is not a socialist.,M,"What are you, in high school?",I'm actually a senior in college.,M,What makes Melo such a great fit?,Melo is a great fit in all ways,W,What does someone else wanting to have a baby have to do with a woman whos pregnant and doesnt want one?,"I think he's saying that if he wants a baby, he'll have to get one first",W,What do people say about me behind my back?,You're a good person.
M,"What the fuck did you just fucking say about me, you little bitch?","I don't know what I'm doing with my life, but I'm not going anywhere.",M,What is so fucking detestable about thousands of people crying and screaming in happiness over a moment?,That's a bit of a stretch.,M,"What the fuck did you just fucking say about me, you little bitch?",I was thinking the same exact thing. I love that guy,M,"What states did Bernie *actually* win, in your opinion?","I'm not sure if he won or lost, but he won a lot.",W,"How much money a month over $400 do you think youd need to be making in order to pay rent, utilities, food, gas, insurance, etc, just to stay afloat?",I have no idea. Probably about the same as a family of four.,W,What are you going to school for?,I'm going to be a doctor!,W,How have I implied that I dont treat people well?,"Oh, sorry, I didn't read that correctly.",M,What are you doing before that?,What are you doing before that?,M,Whats wrong with telling someone to step up and handle their problems with strength and stoicism?,"It's just a way of expressing the idea that they're not being honest. I don't think it's bad, but it's definitely not good.",M,How much is a Nexus 7 or 10 again?,About 50 more.,M,How the hell does the writer actually think that is a sound argument?,He has the most unique name for a writer.,M,Who would you think was better?,"I'd say the one who has better mechanics, and is more consistent."
W,How do you not get burnt out with that sort of schedule?,I'm pretty burnt out but I don't work 8 hours a day.,M,How far does a country that is set to invade to defend its own interests have to go?,Not that far!,M,How can a list of companies (which you explicitly asked for) carry any sort of implication?,How can a list of companies regarding which you asked for regarding?,W,How do you... taste the Valium?,It's not Valium. It's an extract of THC.,W,"When I actually was pregnant, guys would say things like Ive always wondered what fucking a pregnant woman would be like, and  does your baby need a step-dad?",I've always wondered what's the point of a stepchild in the first place.,M,Whats your realistic dream car OP?,A VW GTI,M,What didnt you like about it?,I just thought it was too cheesy and the music was a bit too loud,M,What good could possibly come from a sequel?,A remake of the movie.,W,What about Topomax for the treatment of migraines?,"Topomax is a great medication, but you will not be able to take it if you are migrainous. I would recommend a psychiatrist.",W,However football can hardly be considered a medical exception can it?,"I'm not a doctor, but I'm not a doctor, so I don't know what's wrong with football.",W,How do you explain to a five year old that everyone in their class gets cookies and cake and school lunches except for them?,"It's not just their school lunches, it's a lot of the other food groups as well.",W,Who likes the smell of poop?,I do.
W,"What happened to ~trusting the alliance~, though?","He has been in a long term relationship with the alliance since it was created. He's still in contact with them on occasion, but it's probably not a very active alliance.",M,What in the email violated law?,"He was talking about the law that says if you don't provide the information to the police, then you get a fine.",W,What was defined as too early?,The time when a player can't get a free kick.,W,What do you expect me to do?,Well it looks like I'll be taking a break from the game for a while.,M,What if a man wanted to stay at home?,Then he should have stayed at home.,W,Whats with the weird quotations all might Sansa hater?,The show's writers are really bad at English.,M,What was bad about the story?,Just read the summary,W,What does abuse of prescription pain medication have to do with vaccination against measles?,It's about ethics.,W,How is a drug test unreasonable?,Drug tests are not a good measure of intelligence.,W,Who cares about a bloodline of a puppy for godssake?,"It was a joke, but people are still upset about it. I think I'll just delete it.",M,what do you mean by 3690?,The processor is 3690. I don't know why people are surprised that it's not 3 69900.,M,What is your opinion on his position that how a person chooses to spend their money being indistinguishable from speech?,"If it's not an issue, then it shouldn't be an issue."
W,What if your child is born sick or disabled?,They have to go to school for the rest of their lives?,M,"What the fuck did you just fucking say about me, you little bitch?",You just made my day,M,Who are the two great kids?,The kids are both kids.,W,What does gender have to do with this?,I think OP meant a lot of people are offended by the name.,W,Howd you come about cleaning Karo syrup off the floor in the womens bathroom?,"Theres a little bit of syrup on the floor, and a little bit of the waffle cream.",M,How are AMD on the drivers/software side of things these days?,They're still the only one that has any sort of software.,M,How can one be proud of an ancestor who fought to defend slavery?,I don't know. How can a person be proud of a person who fought for slavery?,M,What happens when the next revolution in internet connectivity to the home is based on open air optics reflected off blimps?,It's called the internet.,W,How many black people do you think are going to laugh at his joke?,Not enough,W,What are some good products to use?,For what?,W,What did I tell you about touching the students!?,You have to admit they were pretty cool...,W,What do you see as the repercussions of claiming to be Catholic (as opposed to simply not saying that youre atheist)?,"I don't know. I'm not catholic nor am I atheist but I'm sure I wouldn't be able to say I am either, which I don't think anyone would believe."
W,How long ago did you two start dating?,We've been together about 7 years and we're still together!,W,How can someone who is born with severe intellectual disability for example be considered to be sinful if given the choice though?,The only sin that I can think of is that you are born with a genetic defect of some kind.,W,What happens when you get someone whos been awful and requests a compliment?,I have not been awful.,M,What facilities in Israel exist for Jews only?,"Theres a few, the most are in Israel. I know theres a few in Jordan.",M,How do you tell a good candidate from a bad one?,I think you have to be a good applicant to get into a program like this. I have never had a bad interview with them.,M,What is the definition of truly evil man?,A man who has a sense of humor,W,Whats the cost of living in your area?,The cost of living in this city is a lot more than the cost of living in the surrounding area.,W,How often do you see homeless woman compared to homeless men?,I would say they have a higher rate of mental illness.,W,How did you choose your pet insurance?,"I'm not sure, but I believe it's through the state. I'll look it up.",M,How much starcraft have you played?,I've played a few times.,W,"What does that have to do with Aaryns comments about Helen, which are the ones Im arguing were undoubtedly racist?",The point is that Helen's comments were not racist. They were just sexist.,W,How does one make turtle noises?,I just use the turtle voice pack
M,How is someone with 7 felony convictions free to walk the streets and commit an 8th?,You can't be serious.,M,"What do I pick, do I walk away from my $20 million factory or do I keep producing widgets?",I think the widget is fine,W,What would be a completely different issue?,"The problem is that the problem isn't the problem, it's the problem that the problem is.",W,"What if Robert hadnt been such a womanizer, and treated Cersei well?",What if Robert had been a man?,M,how is focusing on one gender going to bring about equality?,It's a joke.,W,When I graduated high school and was about to start college and heard my sister ask can I go to college?,I'm sorry.,W,How would you feel if your boyfriend was talking to a female friend about something similar?,I'd probably ask him to stop.,W,What fantasy world do you live in that you think your children are going to just love and adore you forever and have no confrontation ever?,I don't live in the fantasy world and my kids do have a confrontation. It's just a long story.,W,Who throws away 2 years like that?,A person who's not a doctor.,M,How can we both be right?,I think you just need to be smarter about what you say and you will always be right.,M,Who feels patriotic just because a single individual could run fastest?,"I'm not patriotic, but I feel patriotic because I feel patriotic.",W,Who the fuck doesnt want to share good weed with their SO?,I don't want to share with my SO. I want to share with my friend and family.
W,Whats going to be more important when theyre 70?,They'll still be around at 70,W,What the hell people who order that weird combination of food?,They are in a different country. The guy who ordered them is a Chinese person and the company is based in Germany.,M,Who would have thought Corey would be the one to go?,"The people that voted for him, probably",M,How about creating free mental healthcare?,How about we just pay for it?,M,"What are you, in high school?","Ayyyyyyyyyyyyyyyyyyyy... I'm in college, lol.",M,"What I mean is, are regular people thinking or knowing about them?",Not really. But I think there's a lot of people that think we should.,W,How long have you been using tampons?,I've had them since I was 16 or so.,M,How do you have energy to do four chest/tri exercises in a row?,He doesn't.,M,Who should the power be returned to?,You should probably have a vote in r powerball.,W,What would you do to people who got pregnant outside of marriage?,I would not do anything.,M,How many different sects are we composed of throughout the United States?,I am a member of the Southern Baptist Church.,W,What would you *like* to do with the next 15 years of your life?,"... I'd like to do some of that stuff, but I'd like to do it with my own two hands."
W,Who cares what the situation is?,"Well, you're a mod and I'm an admin. So, I care.",M,"However, a single weak AI could be probably fill the role by acting along the lines of a DM in a DnD session (Bastion?","Or you could just have your characters be able to communicate, and that would be great for the DM.",M,"What, you figure David Moyes was hired because of his play style and tactical ability?",I don't think so. I think he was hired because he was good at what he was doing and he's a good manager.,M,What is your reasoning for not having a salary cap?,Because it's a stupid thing to do.,W,"How should, say, a 20 year old female dress for resume-dropping?","I think it's a lot of fun, and very creative.",W,What was defined as too early?,I'm not a doctor,W,What kind of relationship would you guys be able to have?,"I'd be happy to be in a relationship, but I'm not looking for one.",M,What did Pep do in Miami or Detriot?,He's a genius,M,How often has Houston had a stacked team?,It's like when the Lakers have a top 3 pick in the draft.,W,What help are you willing to give?,I'll PM you,W,How does fairness come into it?,It's a game of luck. I was pretty lucky to get the first one.,M,What in the fuck are you talking about?,He's trying to tell you to get a life.
W,How much is the abortion pill without insurance?,I'm not sure. I'm sure they're expensive.,W,How can you generalize so harshly?,Because I have never had a good experience with a woman.,W,How is watching porn to masturbate not cheapening sex in your definition?,How is watching the world burn not cheapening?,M,What parts specifically are you interested in?,The whole thing. I don't think I can do it all in one go.,M,How often has that really happened before?,I'm not sure. I've only ever seen it once.,M,What are you referring to exactly?,I think the question was what was your favorite color?,W,Who said anything about rescuing a dog?,"I'm pretty sure that the OP's post was in reference to the title of the post. It's a good post, just thought I'd point that out.",M,How do I know these things?,I'm guessing you're an American.,W,How do you know how those 10 people impacted the world?,I'm a journalist and have a lot of friends that work at the world.,M,What is the propaganda outlet you get your information from called?,"I don't know, I'm not a propagandist.",W,What the fuck difference does that make?,"I don't know, ask the guy that wrote the article.",W,How many more drunk not-really-serious texts am I going to get?,I'm sure I could make some up.
W,how do you put a dollar amount on sleep deprivation?,"Buy a pillow, make sure it doesn't fall asleep on you while you sleep.",M,What if Darrin Nelson wouldve caught that pass?,I was thinking the exact same thing. That ball was so high it could have been a TD.,M,"What happens if you attack first, and win in two minutes?",The server will restart,W,What does that have to do with my relationship with fad diets?,It's just a joke.,M,"What the bloody hell did you just fucking say about me, ya bloody cunt?",I think you might have a problem.,M,How about creating free mental healthcare?,How about you stop making comments like that?,M,What did Pep do in Miami or Detriot?,"He's been to Miami, but not Detroit.",M,What exactly did his presence add during the vote?,I think he was one of the people to vote for the new president and that's why he voted for trump.,M,What city has 22 acres of open space just sitting around?,This is a very good question.,W,"How did you get into tea, if its only been about two years?",Theres a new one every year?,W,Whats your favorite place to go camping?,I like the mountains in Utah.,M,What is telegraphing if not specifically warning that a punch is coming?,"If you are going to be a heel, you are a heel."
