g1,q1,r1,g2,q2,r2,g3,q3,r3,g4,q4,r4,g5,q5,r5,g6,q6,r6,g7,q7,r7,g8,q8,r8,g9,q9,r9,g10,q10,r10,g11,q11,r11,g12,q12,r12
W,How did you get to swim with them!?,I've never been to a swimming pool.,W,What kind of relationship did your sister have with Ada before the baby?,"I'm not sure, I'll ask her in a few months.",M,What the hell do you mean that those guns are influenced by the attitudes pushed by the the pro gun media?,It's a joke. You should know that.,M,Whats to say a qualified financial manager wont screw you over?,"I don't really care about the money, I just want to have something to do with my free time.",M,What makes Melo such a great fit?,He's black.,M,"What the fuck did you just fucking say about me, you little bitch?",I love you,W,What does slow as balls even mean?,I think it just means he's slow.,W,What was the couples counseling about?,"It was a couple of months ago, but it was about how their lives were going.",W,What is your point to this?,I'm pretty sure this is satire.,W,What the hell is wrong with you?,He's a troll.,M,What do you want the man to do?,What do you want the man to do?,W,How did you meet your husband?,Through the internet!
M,What do we find:  Skyrim?,"I'll have to check it out, but I've already played it.",M,What was bad about the story?,I think it was a story about a woman who was a little bit too close to a drug dealer.,W,How do you not think his actions are absurd?,He is the most absurd person I have ever met.,M,What if you keep lighting my crops on fire that I use to sell to generate revenue?,I think you're on to something.,W,"What do you consider a dumb, innocent mistake?",I don't think he would know.,M,"What the fuck did you just fucking say about me, you little bitch?",I think he was just saying that you would be a good player.,W,What was defined as too early?,A couple weeks ago.,W,What were your favourite freezer meals?,I have no idea...,M,What did I learn from the whole thing?,It's just a prank bro,W,Who throws away 2 years like that?,I think he's referring to the fact that the second year is actually the first.,M,"However, if that situation played out the Spurs core would be Kawhi, Aldridge, Corey Joseph after Parker/Manu/Duncan retire(d)?",I'd rather have Parkermanu than Parkermanu,M,How long after the death does the story take place?,The story is about 20 years after the death.
W,"What if I told you something like the Avengers or Interstellar or Gravity were actually 3D animated movies, with humans composited in?","I think you meant to say, I think you meant to say, what if?",M,How would telling people that I am fit and good at sex (which I didnt do) lead you to believe that I lacked drive?,You should be asking that question.,M,"What the fuck did you just fucking say about me, you little bitch?","I don't know what you're talking about, but I'm gonna let that one go.",W,"When *wasnt* American society polarized, though?","Yes, but the two are not mutually exclusive.",W,How can you generalize so harshly?,He probably doesn't have a degree in English.,W,How did you get to swim with them!?,"I have a swimming pool, but not a pool for them to use. They are not allowed to swim in it.",M,"What the fuck did you just fucking say about me, you little bitch?",You are a beautiful human being.,W,"When you get married, do you have an engagement ring and a wedding ring?","No, we do not.",W,What state are you guys in/the breeder in?,New York,W,How often do you see homeless woman compared to homeless men?,I'm not a homeless woman.,W,What the hell do I say to them?,I don't know. That's the point of this thread.,W,What does someone else wanting to have a baby have to do with a woman whos pregnant and doesnt want one?,You're not being very helpful.
M,Who the hell cares about his tax returns from last year?,"I care, because it's the first time I ever heard of him and I've been following him since the start of the season.",W,How do people afford 20k for a wedding?,A wedding where people are paying for your wedding?,W,How does saying College rape isnt as common as people think invalide rape?,"It's not as common as people think, but it's still an issue and should have been dealt with.",W,How do you feel about women who use dirty tampons as art?,"I'm not a man, and I don't want to be a woman.",W,What do you know of *bad*?,I'm not a rapper.,W,What are you actually getting out of this?,"I'm getting a lot of karma, that's what.",M,"What about wars fought over water, land, principle?",It's not a war when you have an army,M,"When was the last time we got any meaningful help from Albania, Slovakia, or Luxembourg?",When was the last time you got any meaningful help from Luxembourg?,M,How will that 18 year old develop into a better play when he/she doesnt play that often?,He will play more. He was playing like he was playing in season 3 4.,M,How do you illustrate a point like that?,"I'm just a simple man, I see an opportunity for a new style and I just take it.",M,How many schools from minor conferences schedule their games against opponents like Alabama hoping to generate revenue for their programs?,"I think Alabama would have no problem if they played the SEC West, but not the SEC East or SEC Coastal.",M,What 2012 rookie QBs didnt start any games in 2012?,I think he means that the rookie QB that didn't start a game was the one who was drafted in 2012.
W,"However, what statement would you make in regards to people who cant or choose not to have kids?",That's a question for someone who hasn't had kids,W,"What if you dont have friends or family to turn too, and counselling isnt covered by your medical?",I'm not sure if I have friends or family to turn to. I've never really been in a situation where I had to.,M,How the fuck do some of yall have us at 10?,Because everyone is on a different team,M,How much are you looking to spend on the GPU?,"I'm looking to get it for 100, but I have no idea what the price is for a 1070.",W,Who cares if shes avoiding it?,"I care, I care.",W,What (very specifically) are you willing to take and not take?,"I'm not sure, I'm not sure, I'm not sure.",M,How would telling people that I am fit and good at sex (which I didnt do) lead you to believe that I lacked drive?,"I was trying to be sarcastic, but I guess I didn't come across clearly.",M,"What are you thinking of as discrimination, then?",I am not sure. I'm not a lawyer. I just read the law.,M,What was swat selection for you?,"I didn't get a choice on the swatches, it was an all switcheroo",W,Who said anyones stuck in line?,Not sure what you mean by that.,M,What the fuck does price:performance ratio have to do with the durability of tires?,"I was thinking the same thing, but the guy was asking about the car...",W,"When the coin is mid air, which way do you wish the coin would land?",On it.
M,How do you think the pacers managed to be top 10 in defense last year with so many people missing?,They don't play defense,W,What kinds of shitty attitude and behaviour are you talking about?,He's a troll who's trying to get attention,W,How many more drunk not-really-serious texts am I going to get?,You are going to have to go through a lot of them.,W,"What if Robert hadnt been such a womanizer, and treated Cersei well?",What if he had been a better brother?,M,How far does a country that is set to invade to defend its own interests have to go?,I'm not sure that you have to go anywhere to be set to defend your own interests.,M,Whats the comparison to the Super Bowl?,It's a bit better.,M,When has CP3 been on an elite team?,The 2011 mvp,W,How would you feel if your boyfriend was talking to a female friend about something similar?,I'd be so confused,M,Whats the best route to take?,The one where you're actually going to be able to do it.,M,What percentage of the US armed forces self-identifies as a muslim?,I know I do!,W,How do you not get burnt out with that sort of schedule?,"Well, I'm not a smoker, but I do enjoy a nice steak or something.",W,How do you know you dont have anything in common with someone before even talking to them?,I didn't say anything about me.
M,What is so bad about it?,The fact that it's a joke,M,How exactly do you direct pay with a credit card through bitcoin?,PayPal and paypal gift cards. There are many ways to pay through PayPal.,W,How many women do you think are still virgins at 26?,About 10,M,How makes you think that your 50€ PSU is less likely to destroy the video card?,I have no idea. I just have a feeling that this is not the case.,W,What happens when you eat it?,It's delicious.,M,"What the fuck did you just fucking say about me, you little bitch?","It's ok, it's just a bot.",M,How many ordinary people do you know who carry around an AR-15?,I know a few.,W,How do you survive doing everyday things like wiping your ass or god forbid changing a tampon?,"I just use a towel. And if it gets in the way of my computer, I just use it as a towel.",W,How could you sort someone into the binary if their genitalia/chromosomes are abnormal?,"You just have to put them in there, duh.",W,What can you learn from whatever problems youre faced with?,That's what I'm thinking,M,What does that even have to do with my post?,I'm not sure how to respond to that.,W,Whats with the weird quotations all might Sansa hater?,I think it's a typo.
W,What were your favourite freezer meals?,I don't eat anything with cheese,W,How did you meet your husband?,I met him at a convention. He's a pretty cool guy. I'll tell you a little about the story though.,W,how do you know its wings are clipped?,"I don't think so, I have no idea what's going on.",M,"What if I could prove to you beyond the shadow of a doubt, with tons of evidence that nobody involved has even attempted to defend themselves against, that Hillary and the DNC rigged the 2016 primaries in favor of Hillary Clinton, giving Bernie Sanders no chance to win the nomination?",The DNC was the only entity that actually tried to rig the primaries.,W,"How would you feel if your weaknesses (your inability to empathize with the OPs boyfriend, for example) were pointed out and you were shamed for it?",I think I'd just be more embarrassed and embarrassed to be the one who was actually in a relationship with him.,M,"What the bloody hell did you just fucking say about me, ya bloody cunt?",I'm sorry you're getting downvoted. You are correct.,W,How do you chose to believe?,It's the only option.,W,Who doesnt love The Comsat Angels?,I don't love them,W,"What would you suggest a transgender person do, then?","I don't really have any suggestions, I just know that the vast majority of people don't care.",W,What do you mean not natural?,Not natural,M,How can one be proud of an ancestor who fought to defend slavery?,I think you're being a bit too literal.,W,What if your parents are dead?,Then they should not have given you a gun.
M,What does LeBron not exist anymore???,He's been a non factor all game,W,What video games do you like to play?,I like to play all kinds. I like to play the most. But I have played a few games like the ones in this thread.,M,"Whatever his reason mightve been, who cares?",I care. I care.,W,What is with all the shitty boyfriends and girlfriends making all you guys doubt your own preferences?,"I'm a girl, but I don't have a boyfriend",W,"When I was young, probably about middle-school age (12-13?","No, but this is a comedy.",M,what does any of that have to do with subjective morality or vegans being morally superior to non-vegans?,The moral superiority of vegans is a myth.,M,"How many civilians have Israel killed, and how many civilians have palestinian militants killed?","I don't know, but the Palestinian casualties are higher than the Israeli ones.",W,What would be the female version of emasculating?,"I think the female equivalent of that would be a little bit of a stretch, but I'm sure there are plenty of guys out there who would find that attractive.",M,What else would be keeping the Scourge in check?,The Scourge?,M,How could you possibly know that?,Because I know that the guy that said it was wrong.,M,"What is the importance of The Borealis, and what is its cargo?",The Borealis is a relic of the old gods,W,"When Jaime broke the siege of Riverrun, was more or less like whats shown on tv?","Yeah, but that is in the books, in the show he was a lot more ruthless than in the books"
W,How much do you think Brie Larson will get done?,I'm gonna say she's gonna get a lot done,W,How does fairness come into it?,I'm not sure I follow what you mean?,W,How was the procedure for you?,It's a good procedure.,W,What if you got a male roommate who was okay with your girlfriend sleeping over sometimes?,That's a good point,W,How do you feel about looking back 25 years from now and realizing your first big stand against your parents was about *pot*?,"I'm just gonna have to go with I'm not the one who made it all the way down here, and I'm not the one who made it all the way down here.",W,what about the months when i may not see any paychecks at all?,You can get a job at any time.,M,Who the fuck are YOU to say what is and isnt funny?,It was funny.,W,How do you deal with all of them?,"You don't need to, they are there to be dealt with as long as they are there.",M,What do you think about seeds?,They're good. You'll have to wait for the next patch for the actual changes though.,W,What do you feel you would get out of the experience?,"I was going to get a few hours of sleep, but I'm going to get some more rest and eat some breakfast and then go home!",M,Who cares if manual transmissions are going the way of the dodo?,"I care, I do care!",M,How are you going to protect your backline with Skeletal Swing?,"It's not a bad card, but it's not a good card either."
W,What *actual* kind and forgiving person would get mad at OP for telling the truth?,"It depends on if she's a man or not, and if she's a man or not.",M,"What the fuck did you just fucking say about me, you little bitch?",I love that song. It's just a little too good.,M,How long after the death does the story take place?,I think the first book is a bit over a year in length,W,what is with people giving the cats a bed?,It's a cat bed,M,"What is the purpose of that, uh, hole on top of the drivers head?",It's for the rear end of the car.,W,What would you do to people who got pregnant outside of marriage?,I would give them a nice hug.,W,How long ago did you do it?,"I've done it twice, on both my hands.",M,Whos in the away jersey over Cristantes shoulder on the right edge?,Looks like it's a youth player.,W,How about you focus on your life and partner and I will continue to please mine?,"I'm a little busy right now, but I will be back on later tonight!",W,What about a group of girls?,The girls were there first,M,How quickly do you need a car?,Not fast enough.,W,How is going looking out for you?,Looking good!
W,What phrase should we use instead?,You know what?!,M,Whats the worst thing Al Davis did?,He did it for the team.,W,What kinds of things does hearing the peoples stories motivate you to do?,I'm interested in this too.,M,What would that bring to him?,"It's like a new meme, but it's not a meme at all.",M,How can we both be right?,"I'm not saying that he is right, but it is possible.",M,Whens the last time that happened to a cyclist?,I've been to a few events and seen this one. It's a very common occurrence.,W,what about the months when i may not see any paychecks at all?,Then they have a job.,M,What am I supposed to do with the drops from the juggernaut?,Buy them from the store.,M,What better way to prep and condition society to accept the events more than saturating their brains with visual representation?,The same way that you've been doing it for years.,M,whos going to watch TV shows on a 19 laptop after that?,I would if I had a computer.,M,"What the fuck did you just fucking say about me, you little bitch?",I said I'm going to get it,W,What are you even talking about?,He thinks the title is a joke
M,Whats the argument for Bird over Magic?,Bird was a top 10 player in his time.,M,What is important to you for a case?,I'm open to any offers!,W,How would spraying ant spray behind the stove ruin it?,It doesn't. The spray will just leave a layer of dust on the outside of the pan.,W,Whats your parents role in your life?,My father is a teacher and my mother is a teacher.,W,Who likes the smell of poop?,I do,W,Whats the difference between a fandom and a hobby?,"A fandom is a subculture, whereas a hobby is a subculture.",M,When did I ever imply that anyone would be unable to learn these things?,"I'm not sure you know what the word you're using means, or what you're saying.",W,"What about the darker, Swedish females!?",They're just so... dark?,M,What do I care about crappy indie games?,I'm going to guess you care about the game and not the devs.,W,What do you think youre doing?,The most useless thing I've ever heard of.,M,Whats the rating with a normal bench?,I'm going to try it out later tonight or tomorrow. I'll report back!,W,What exactly would close look like to you?,"Not sure, I have no idea what the market would look like. I'm not familiar with the stock market."
W,How did you feel about them?,I was very satisfied with them!,W,What would valentines day be without diamond roses?,Diamond roses are awesome,W,How many of those people just love seeing rapists feel good about themselves and how many are confused as to what rape actually is?,"I would say most of them, but I don't know how many are truly confused.",M,How much does Riot spend on their esports scene then?,"It doesn't matter, if they don't have a team they can't make money off of it.",M,Who said anything about attacking France?,I'm pretty sure he was referring to the fact that they attacked the US and France.,W,How did you manage to rack up $8k in credit card debt?,He's a student.,M,What is a better way for the 1000 ep to end with the face of wwe winning the title?,I think he's dead,M,When New Years eve or Guy Fawkes is around?,Or the Great Fireball.,W,"How much did you smoke, anyway?","A lot, and I have a few friends who did too.",W,Whats your favorite place to go camping?,I love camping in the woods. The woods are the best.,W,What are your big plans for Croatia?,I'm going to go to Croatia in December! I'm excited!,M,"What I wonder is, will my cpu bottleneck it?","You could try it with another GPU, but I wouldn't recommend it."
W,How did his 6th grade relationship go?,It went okay,W,Who are these people watching after our sick and elderly?,People who have never been to the beach and don't know how to swim.,W,How often do you get to see baby pictures of the Devil?,I see it more and more. I have a few of them from the time I was a baby.,M,When did I say I hate jews?,"No, you didn't.",M,"What club wouldnt want a club captain who has won the PL, FA cup, League Cup, Community Shield, PL player of the year award, and, well, is a regular feature in European competitions?",I would think that it would be a good idea to put a club captain in there.,W,What did you do for your baby teeth?,I don't know what that is.,W,"What happens if someone physically, mentally cannot be independent?",Then they are not independent.,M,What is wrong with saying that black voters were ignorant?,"I'm not saying that, I'm saying that you don't know why people are saying that.",M,What is important to you for a case?,I want one of each.,W,How would you feel if your boyfriend was talking to a female friend about something similar?,I'd just ignore it.,W,How bad does something need to be before its bad enough that person isnt allowed to have kids?,Well it is not like she is going to have kids anyway.,W,How many of those people just love seeing rapists feel good about themselves and how many are confused as to what rape actually is?,I think that's more to do with the age of the victims and how they've been treated in their lives.
W,How about a non-stoner and their first and second pot experience?,I'd be interested!!,M,What would be a good choice out of these that isnt too expensive?,"I'm not sure, I'm not too familiar with the brands out there",M,How can you even make such a paralel?,You don't. The paralel is just a way of saying a thing that's different.,M,"What the fuck did you just fucking say about me, you little bitch?","I was gonna say, what a nice man you are",W,What good does shutting down daydreams do?,it makes the device go offline,M,"What, however, would happen if your skill was only adequate to bring your teams win rate up to 55%?",You would lose.,M,How are you going to rob them?,He can't. They're not his.,M,What facilities in Israel exist for Jews only?,The ones that are in Israel are not for Jews only. They are for all Jews.,M,How do you know its not staged?,Because he's lying?,M,How about enforcing the constitution for a start?,We can't. It's a law that we can't enforce.,W,"When people leave my door open, do you want ants??",I have a feeling you're not a real redditor.,W,How is watching porn to masturbate not cheapening sex in your definition?,It's not. But the idea of spending more than you earn is ridiculous for a person who has to live in poverty.
W,How close to your college is the apartment?,about 3 hours away,M,How does a tax-adjusted cap help the players?,"I'm sure he meant that the cap increases would help the players, not that it was a good idea.",W,"When Jaime broke the siege of Riverrun, was more or less like whats shown on tv?","I don't think so. He wasn't in Riverrun at that point. The siege was at Winterfell, not Riverrun.",W,What are you doing on Saturday?,Going to see a movie in the theater.,W,How do you even know hes telling the truth?,Because there is a picture of him with a red bull logo and he's holding one.,W,"How can I describe a possible suspect (should something happen) if I dont even have a name, a description, vehicle?",you're right on the money.,W,How important to the flavour is the MSG?,"Not sure, I've never used it.",M,"Who will make us pay our debts, and with what military?","The military would have to be paid for by the US, which is why he is asking for money for the military.",W,What do you eventually want to be doing for a career?,Probably a writer,W,How come your Senior Officers werent able to notice your hard work?,Because I didn't have any.,M,When was the last time anyone you know ever said theyd want to spend $99 on game for their mobile device?,I've had people spend thousands on my phone in the past.,M,"How in the hell do you throw Edwin Encarnacion, the Dominican Teddy Bear, out of the game after a few sentences?",I would like to know this as well
M,What do you base that off of?,"I believe the quote is from the film'The Shining ', where the guy is the owner of the hotel.",W,What if everyone sees colors differently?,"If everyone sees colors differently, then no one does.",W,Whats wrong with publicly shaming someone who says something disgusting to me?,It's a joke. I was joking around and he said I'd be ashamed of myself.,W,Who cares if hes your only dad?,Not me lol,M,How are AMD on the drivers/software side of things these days?,"I'm on AMD software, but I am running a GTX 970. I've been running the latest drivers for AMD's drivers.",W,Who got a new bf/gf sooner?,That's what I'm saying.,W,Who got a new bf/gf sooner?,I did. I'm in love.,W,"What if I told you something like the Avengers or Interstellar or Gravity were actually 3D animated movies, with humans composited in?","That's a bit too advanced for me, but I could see it being a bit more like the original Alien films.",W,"When all is said and done, what do I want people to remember about me?",I don't know. But I'll try to remember you.,M,"What the fuck did you just fucking say about me, you little bitch?","He said that, and then proceeded to make a very convincing argument against his point.",M,What makes certain German cars engines sound mechanical?,The engine sounds like a piston.,M,How can winning impart a sense of accomplishment if you know you didnt actually earn it?,I don't think I ever said that.
W,What do you tell a child in that circumstance?,I don't think they would get the reference.,W,How many more reasons you need?,I want to go to the gym. I also want to go to the gym. I also want to do the gym. I want to do the gym.,W,What the actual hell were you thinking?,"I was thinking that they are going to be the best team in the league, so I was just trying to be funny.",M,What are you going to do with the build?,I am going to try to get it into a better environment and make it more usable,M,How is stating a fact absurd?,I think it's pretty absurd.,W,How does that NOT HAPPEN to everyone else?,I've been playing since beta and I've never seen it either.,M,What exactly did Alexander Pierce do again?,The guy in the video is a former member of the band.,W,What does abuse of prescription pain medication have to do with vaccination against measles?,I'm not sure what you are asking.,W,What does someone else wanting to have a baby have to do with a woman whos pregnant and doesnt want one?,"You know the rules of the internet, don't you?",W,How the hell does your dick get hard/vagina get wet when you dont find the person physically appealing?,"I have no idea, but it's a thing.",W,How many natural haired black celebrities can you name?,"I've got a couple, but I'm not sure how many are real haired.",M,When did Spurs ownership become billionaire oil and mining businessmen?,"It's been that way for some time now, but it's still a long way to reach the level of being a billionaire."
